,0
Decent place to grab lunch.,
"
Biggest gripe is you have to go to the counter and ask for a refill on your drink.",
"
Get the spicy chicken sandwich with the honey bbq sauce!",
"I usually visit this chick-fil-a at least 2-3 times a month because it is the closest to my house, but may be driving farther to go to a different location in the future.",the closest
The last three times I have visited (always through the drive-through),
"the cashier has gotten my order wrong (either something completely wrong, or made incorrectly), even when they say it correctly back to you when you're ordering.",wrong
"

",
"The last time I was here I had ordered a milkshake with no cherry as I am allergic to them (which I also said), drove up to the window, and was handed a milkshake with a cherry on it.",allergic to them -LRB- which I also said -RRB-
"When I gave it back and let them know it was supposed to no cherry, I watched the cashier through the window pick the cherry out with a napkin and cover up the leftover juice with whipped cream, then give it back to me.",
"After asking if it had been remade, the guy didn't know what to say and didn't answer me until I told him it needed to be remade and I had seen him just pick it out with a napkin.",
"

Fast forward two weeks later, my husband and I are at chick-fil-a again, and we order a grilled nugget meal.",
"Pulling up to the window, we are now given a regular (breaded) nugget meal.",
"When we asked about it and gave it back to them, the cashier (who didn't apologize) informed us they would need to charge an additional $0.80 for the price difference.",
Seriously?,
So now we're again waiting for several minutes for the correct food after getting the wrong order.,
"The service as this chick-fil-a used to be great, but lately is seems like all of the workers are high school kids wanting to gossip and hang out without paying attention to helping customers or doing their job.",great
"Judging from the other recent yelp reviews, we're not the only people this has happened to.",
The service/management at this store really needs to get it together.,
"Every single time we have an issue especially in the drive thru.... they rush you when taking your order, cram all of your food in 1 bag, make your order incorrectly or forget parts of your order before pushing you through to get to the next person.",
I have tried to give them the benefit and go back but its a reoccurring issue.,
"

Last time I stopped and checked the order and with no surprise we were missing a sandwich - I went back in and spoke to a manager who was unapologetic and rude demanding a receipt when I had just pulled off the drive through, I explained this is a reoccurring issue and he directed me to the wall to get information if I would like to let the operator know.",unapologetic and rude
The management needs to get it together - Don't waste your time go to somewhere that cares about your business.,
Plenty of other options in that area.,
"There is another Chick Fil A five minutes from my house, but I drive 15 min to this location because they have the most fun and friendly staff!",most fun and friendly
 I always feel welcome when I come in.,welcome
The food is fantastic!,fantastic
"Chick Fil A has the best chicken nuggets, waffle fries and fresh lemonade!",
 Yum!,
"Love this place, try the chicken bagel spicy.",spicy
 Amazing!,Amazing !
 Always go here any chance I get.,
 Thanks.,
"Five stars
I grew up on CFA
",
It is Hot Good and well Extra Good.,Hot Good
Order what you like its all GOOD.,all GOOD
"
All white mean chicken the king of sandwiches when it comes to chicken.",
The fries are the best ever to touch your lips and gums.,the best
They have pure honey & they know I'm on my way so they never run out.,
This CFA was always busy and full of kids for mine to play with.,busy and full
We wound up here several times on a recent visit to our family.,
"I mean, it is CFA, they treat you well, the food was great, and the play area was big enough to fit the 10 or so kids that were in it every time!","great, big enough to fit the 10 or so kids that were in it every time"
"Yum, not sure what there isn't to love about this place.",not sure what there is n't to love about this place
Food is great and fresher than many other fast food places.,"great, fresher"
The staff is friendly and always accommodating to my children and I.,friendly
"Yes, they get busy, but they are great at still getting you in and out.","busy, great at still getting you in and out"
What can I say except I have soft spot for Chick-fil-A.,
  ,
Perhaps it's their world-famous chicken sandwich.,world - famous
Or perhaps their hatred of the sacred cow.,
 Either way I like it.,
"I prefer the plain old number one sandwich combination, hold the pickle.",
"Also, their milkshakes are rather tasty.",rather tasty
 ,
"However, their waffle fries could use some improvement, .",
as could their approach for filling up soda behind the counter.,as
"Other than that, I'm sorry",sorry
"Yelp, I'm giving a fast food restaurant four stars.",
"Yes, I'm reviewing @ChickfilA, but with good reason.",
"

Marissa worked the counter today, and epitomized service with a smile!",
"She delivered our food to the table, and even asked if we needed refills on our drinks.",
"She was one of the friendliest people I've ever encountered at a fast food restaurant, and should be praised by her employer.",
"The food is pretty good, and I would probably go to Chik fil-A before KFC.",pretty good
But I just want to rave about the service.,
"Fast food can be delicious, at least at Chik-Fil-A!",delicious
"

I met some moms here for a little play date and lunch, I hate McD's and this is another option - a better, cleaner, more nutritious and delicious option.","better, cleaner, more nutritious, delicious"
"

UPS:
",
"My daughter hates nuggets, any nuggets, anywhere.",
" She LOVED these nuggets and the fruit cup, she finished it all!",
" 

The play area is smaller but it's nicer and cleaner and has less kids running around (at least on this afternoon).","smaller, nicer and cleaner"
They have delicious and fresh salad options which also come with their scrumptious chicken (you can get grilled too).,"delicious and fresh, scrumptious"
 Love the dressings!,
"

Friendly and helpful staff.",Friendly and helpful
"

DOWNS:",
"
A little pricey for those fresh salad options (almost $8)

",A little pricey
Sucky kids toys (comic book?),
The best customer service...matched only by their great food!,
I love the Broccoli-Kale salad and grilled nuggets!,
And lemonade!,
And milkshakes!!,
Always friendly.,friendly
Solid Chik-Fil-A. I came here for lunch and ordered a Chik-Fil-A sandwich with medium fries and a drink.,
The staff was incredibly friendly and brought me my food when it was ready.,"incredibly friendly, ready"
The food was great!,great
Just like every Chik-Fil-A I've been too.,
The chicken was nice and crispy.,nice and crispy
"The fries were great with polynesian sauce and what can i say I'm a fan of the place, so it was very enjoyable.","great with polynesian sauce, very enjoyable"
"As I was only on vacation, but come down here eery year for Spring Training I will definitely drop by again in the future when I am back in the area.",
Worst service ever.,
Dined in and got no straws after ordering two drinks and also NO napkins .,
Won't drive thru service is better I definitely won't Dine in again.,better
I do like their food.,
I like how the kid meals come with something educational instead of some piece of plastic junk.,
"The only thing I would say is for the price, I think their portions could be a little bigger.",a little bigger
I am always wanting just a couple more waffle fries.,
I have had ALOT of bad experiences at this location but this is ridiculous.,ridiculous
Ordered a #2 chicken sandwich...,
I get this??,
How do you forget the bun?!,
"Honestly I'm just going to start driving the 20 minutes to the Deer valley location because between this stupid shit, last time I didn't get my fries and paid for them (with NO Return phone call from the manager), and the terrible ATTITUDES from the children that work there (I thought maybe I was being petty but apparently this is a thing here)...",petty
I'm over it.,
"Get it together Chick-fil-A, or at least learn ACTUAL customer service when you f up.",
"The food was good, really overpriced.","good , really overpriced"
 The service was great.,great
Everything was really clean for a fast food place.,really clean for a fast food place
 It seems like every time I get to have Chic fil a that their food shrinks.,
I was here for the opening of the store.,
I did that overnight thing where I hung out in the parking lot and got 52 free cards for meals.,
That was mang years ago.,
"
",
"Since then, I've gone back many times.",
The food has been consistent and the service has always been great.,"consistent, great"
"When I worked nearby, I would come here for many busy lunches, and they always kept everything moving very quickly.",
While it's not the place to go for anything healthy the salads are very good and generous in size.,very good and generous
 I had the grilled chicken sandwich that had a funky taste.,
The lettuce covered it like it was hiding the piece of chicken.,
"Almost as a warning ""why are you eating the grilled chicken"" 
It just is not the place to order this item.",
"
It was rubbery and tasted like it was 100% rib meet.",rubbery
It is shaped like a breast and has lines on it like it is grilled.,
"4 stars for the salads, stay away from the grilled stuff and go with the signature fried stuff.",
Always to go this Chick-fil-A location since it's closer to my place.,closer
"Ordered through drive-thru spicy deluxe sandwich, they read me back the order at the pick up window and my receipt also shows spicy deluxe and label on the sandwich box also shows spicy deluxe.","spicy, pick up, spicy deluxe"
"Came back and opened the box and it's grilled sandwich, how come the order go wrong at three different check points.",
Is this way u run a successful franchise with bunch of folks who does not know how to run the process flow for delivering a simple order.,
"Management needs to wake up at least now, also see bunch of reviews the same way.",
"

Got to drive back again and change my order...staff inside have no clue how this happened and they apologize just because they got to say something.",
"

Bunch of lazy folks with no focus on customer service are running this location.",
Stay away !!!,
Yum yum yum.....,
I wanna rub chick fil a's chicken all over my face!,
It's soooooooooo good!,good
"

Get a number five.",
12 piece...,
The 8 will not be enough.,enough
Yum.,
Honey as ur dipping sauce is amazing!,amazing
The waffle fries are delightfully delicious.,delightfully delicious
The lemonade is the best you have ever had!,
I'm scared that this location is so close to my house.,so close to my house
"

This location is clean and the staff is very friendly!","clean, very friendly"
"Went at the busy hour of lunch, they were on their game in and out of the drive thru in less than 10min.",
Love the chicken wrap with spicy sauce and love the waffle fries.,spicy
This Chick Fil A is awful.,awful
The last 3 times I have been here I have gotten soggy fries that are undercooked.,
How do you consistently mess up fries??,
I love chick fil A,
but this location sucks.,
I've learned my lesson and I just have to drive up to North Scottsdale to get my fix.,
"Oh, Chic-fil-A how I love thee.",
"Let me count the ways...
1.",
"Good food
2.",
"Fast service
3.",
"Friendly staff
4.",
"A clean store
5.",
"Philanthropic giving

",giving
Our two boys love coming here for dinner.,
We will use any excuse to come.,
We have never had a bad meal or experience.,
Love this place.,
One of the three fast food places I go to.,
"Best chicken nuggets and waffle fries

",
"The lemonade is super good as well

I love the grilled chicken sandwich also
",super good
It is fresh all the time,fresh
The only reason I give this chickfila on Tatum 2 stars is because chickfila's food is so good.,so good
BUT this chickfila is so poorly run!,so poorly run
If you go through the drive thru expect to wait at least 10 min.,
Do not go when you are in a hurry.,
It is so slow.,so slow
"Also they rarely get your order correct and you MUST check your order, including your drink, before pulling away.",correct
"This chickfila needs some help with speed and accuracy, it is not run like all the other chickfila's that I have visited through the years",
I love Chick-fil-A and go there often.,
 Their recent coupons for free items have expanded the items I like to order.,
 Always polite and pleasant staff.,polite and pleasant
What's not to love about Chik-fil-A?,not to love about Chik - fil - A
Their food is good and the preparation is consistent.,"good, consistent"
This location in particular always has very friendly staff.,"particular, very friendly"
Remember that they are closed on Sundays.,
I've caught myself pulling in there a couple times only to realize that I'm there on a day that they are closed.,
"I appreciate that they are closed on Sundays and holidays so their staff can spend time with their families, however, so I don't mind one bit.",
"My favorite fast food joint, by far.",
Fries are always fresh & the chicken is always hot.,"fresh, hot"
"The only ""complaint"" I have is when I'm craving them on Sundays, they're not open!",open
Haha!,
After a long day at work and didn't feel like cooking dinner so I decided to pick up some Chick-Fil-A on my way home.,
I get there around 6:30 to a FULL drive-thru.,
After waiting almost 15mins in the drive-thru line alone I get to order and quickly get my food.,
I pull out of the plaza and stop less than a block away at a red light so I decide to check my food.,
I clearly noticed I had someone else's order because it was not even close to mine.,
I make and immediate u-turn and return to the still very long drive-thru line.,
I finally get to the order speaker and explain what happened.,
I'm asked to pull up to the window and a very youth and confused teenager tries to make it seem like I'm wrong because that's what I ordered and paid for like it said in the receipt.,wrong because that 's what I ordered and paid for like it said in the receipt
By now I'm steaming mad and ask for a manager.,mad
The manager with plenty of attitude takes the wrong food back and gives me my correct order.,
I ask her what about the difference between what I paid and what my correct order was because I noticed my correct order was less expensive.,less expensive
I told her I didn't need the change and asked if I could get a brownie to make up the difference they owed me + the hassle.,
"She quickly responded something like ""the brownie is $1.39 and the difference we owe you is only $.38 cents",
so you will have to pay the difference plus tax.,
""" I was shocked and lost for words at the awful customer service I was getting from one of my favorite fast food places.",shocked
After a few seconds of feeling like I was going to have a stroke from the anger I finally managed to ask for my $.38 cents back which she quickly gave to me.,
"Since I have yet to eat at any Chick-Fil-A
because my pride don't let me give a single penny to that company.",
I tell this factual story to any one who will listen because I cant believe Chick-Fil-A lost a life time customer over $1.01+tax.,
So yummy!!,
 Healthier than most fast foods.,Healthier than most fast foods .
 They are also much cleaner.,
 I enjoy using their Chik-Fil-A sauce!,
 Make sure to try it!,sure to try it
 They are super fast and very friendly.,"super fast, very friendly"
Clean.,
 Great customer service.,
Family oriented.,oriented
" Excellent tasting, high quality food.",
 They have a program to promote family togetherness by challenging the family to put our cell phones in the box for the whole meal to earn a free ice cream....,
the kids were all over this!,
 Brilliant!  ,Brilliant !
"The marketing director greeted us and took care of us the whole meal...refilled our drinks, asked about us as people, and spread positivity to our experience.",
 I believe her name was Sylvia...,
what a great person.,
We do not have this restaurant where we ar from.....,
we are very impressed.,very impressed
I like Chick-Fil-A.,
"They deserve props for inventing the chicken sandwich, for the cute cow commercials and for maintaining their religious principles.",
"That said, I don't really care for this location.",
"It's cramped, with a lot of tables and a children's play area crammed into a very small space.","cramped, very small"
"Also, no way to refill your soda on your own.",
"Chick-Fil-A overall is a bit expensive for what it is, perhaps in part a consequence of its closed on Sunday policy.",closed on Sunday
"

I tried their grilled chicken nuggets a la carte on my recent visit.",la
How disappointing.,How disappointing
"They came out soggy, sealed in a plastic container, where they had apparently been for quite some time.",
Gross!,
Definitely no resemblance to the promotional photographs!,
"When I mentioned how disgusting they were to another family member, they immediately asked, ""Did you go at lunchtime?""",disgusting
"""They make bigger quantities in advance at lunchtime and the food then is never as good.",as good
"""",
Hmm.,
"Makes some sense, I guess.",
"Still, over five bucks for six tiny slime covered grilled nuggets and the smallest small sized soft drink I've seen in years, leaves me less than enthusiastic in any case.","small sized, less than enthusiastic"
"Plus, call me silly, but I like to eat lunch at lunchtime.",silly
"Gross bathroom, and dirty play area.",
"I go to many locations, never seen one that makes McDonald's seem clean.",clean
Until now.,
Play area had chunks missing in floor.,
 Changing station looked to be on its last leg.,
 Over disgusting.,disgusting
" 
Had to ask for sauces, never at any other location.",
"Just seemed odd, kept behind counter.",
.unlike other locations.,
 Sauce theft an issue here?,
I won't return to this location ever.,
Happy to bring my kids here weekly.,
Love the friendly faces and great food.,
So you can actually skip the toy in the kids meal and get ice cream instead.,
I never knew this before!,
Cool,
Cobb Salad was great!!!,great
Always friendly and polite here.,friendly and polite
Thanks Chic Fil,Chic
a.,
Oh - and the Cool Wrap is also very good.,very good
Not crazy for the grilled bites as there are too few for the price.,too few for the price
Stick to the salad and also try the wrap and you'll be in good territory.,
If you are going to eat fast food this is a much tastier option than some other chains out there.,much tastier
An added bonus is that their lemonade is delicious!,delicious
The restaurant is usually clean and the service is quick and friendly.,"clean, quick and friendly"
I like their original chicken sandwich and the fact that their fries aren't overloaded with salt.,
The chicken is well seasoned and juicy and the pickles add a little zing.,well seasoned and juicy
They are always happy to offer up sauces with your order in case you want to jazz up your sandwich or fries.,happy to offer up sauces with your order in case you want to jazz up your sandwich or fries
I can eat like 1000 of these sandwiches.,
"Great food, everyone knows that.",
"

This place does a lot of community events and has great employees.",
I had a complaint about the coffee and the owner called me and apologized.,
I appreciated it very much.,
Thanks for the fun and great food!,
We like bringing our kids to chick fil a because of the nice family atmosphere.,
We unknowingly came here on a fundraiser night.,
"Even though it was very busy, the tables were cleared fast and the bathrooms were clean.","very busy, clean"
"
I didn't give 5 stars because we were slightly disappoint in the under cooked fries and chicken nuggets.",
We still are everything up,
but I prefer when the fries and chicken are crisper.,
This is extreme to have to yelp.,extreme to have to yelp
But it's that bad.,that bad
Simple problem: wife is allergic to pickles.,allergic to pickles
3 out or 4 visits had pickles on her chicken sandwich.,
Wasted money since we live 5 mles away.,
Called the 3rd time.,
Mgr Said too busy to talk to me.,too busy to talk to me
I left my name and number.,
No call back.,
"Called again, no mgr available.",available
Placed an online complaint.,
Just received an email asking how my complaint was resolved.,
Filled out survey saying it was never resolved.,Filled out
At all.,
From anyone.,
You turned a simple complaint that was your fault into a loss of $80 a week on sales.,
Good job chick-fil-a. I'm completely done and so is my family.,
I hope you reprimand and terminate your terrible regional and general manager.,regional and general
They don't care about their customers obviously.,
"I tried 5 times now, with not one call back.",
The survey asking how my complaint was resolved ess the biggest slap in the face.,
Not cool.,cool
I have been going to Chick-fil-A's all across the country and I absolutely love it!,
All of the staff is the highest quality out of any place I've ever been!,
"The food is great, and is pretty well-priced.","great, pretty well - priced"
"The prices have gone up over the years, but not enough to truly deter people, I don't believe.",
"The kid area was fun for me years ago, and I know it still holds the same value today.",fun for me
"They easily have the best sweet tea out of any place I have ever been to, and am proud to say that I will never stop going to Chick-fil-A!",proud to say that I will never stop going to Chick - fil - A
Our family loves Chick-Fil-A..,
BUT this location needs some work.,
"After the 4th visit today, the drive-thru team is rushed and impersonal and doesn't care to listen to what we ask for.","rushed, impersonal"
"They have messed up 2 out of the 4 orders, and they don't take the time to make sure it's right.",right
"When I asked for additional sauce they say oh it's in there, when in fact it's not.",
The other location at Shea and 101 is by far better customer service and always cares on what we ask for-and checks.,far better
Wish this location would get it together!,
I am addicted to the grilled chicken and fruit salad.,addicted to the grilled chicken and fruit salad
It is low cal if you use the low cal dressing and very filling.,
The staff will go out of their way to get things right- and make your experience a positive one.,right -
 I buy the nugget trays too when I am having guests and it is always the first thing to be finished.,
Had a horrible experience at this location.,
Was given wrong order at the drive through.,
When we got home we realized it.,
Called the restaurant and they wouldn't acknowledge their mistake.,
Asked to speak to manager and they wouldn't connect us.,
STAY AWAY FEOM THIS LOCATION!!!,
Someone pease tell me why is my cheese over my sandwich instead of inside the sandwich?,
Did someone missed that part of training?,
"Incredibly clean, friendly and fresh.","Incredibly clean, friendly and fresh"
First time here and I will definitely be returning.,
We love Chick-fil-A food but we'll go back to the other location we frequent next time we want some.,
"I spoke with who ever the ""manager"" was at this location more than 5 years ago about a large ladder being stored on top of the area small children play in and apparently it is still not a safety concern to this restaurant.",
Went there a few weeks back and they forgot to put my sandwich in my bag.,
I called and let the manager know who took my name and advised me she would replace my meal for me.,
"I go back today and guess what,  she made me Pay for my meal...",
she gave me a free sandwich..,
lol..,
I told her it wasn't FREE because I had already paid for it....now were talking a kids meal..nothing outrageous....but was rude and didn't care if I am getting screwed....,"FREE, outrageous, rude"
I told her I was going to call Corporate and she told me go ahead she didn't care...,
Well they not only lost my business at this location...,
I will post this so people will go somewhere else.,
What a liar for a manager!,
I love this place !,
I could eat there everyday...,
The staff is very friendly and always makes sure you are satisfied.,"very friendly, satisfied"
"P.s: notice that employees can't say ""your welcome"" instead they say "" my pleasure "".",
Lol,
"'My pleasure' is something you will consistently hear at this location, and so do I take great pleasure in devouring everything on their menu from the chicken strips to the grilled chicken bites, and chicken tortilla soup.",
"

What makes their fast food concept so special?",special
The chicken.,
It is so juicy and fresh.,so juicy and fresh
Even the breaded entrees are not overshadowed by the hard and crusty layers of breading other ff chains glob on - on efforts to save on the protein.,hard and crusty
"Here you get generous portions, each one delivering taste and freshness.",
Especially the grilled chicken has a tooth some and juicy flavor.,juicy
"

What u love most about the sides?",
Kiddos get a plethora of fruit in a fruit cup ranging from crisp apples and blueberries to tangy sweet mandarins.,
The lemonade virtually tastes like a fresh squeezed lemon with simple syrup and I am consumed by how amazing it tastes.,amazing
The most terrific thing?,most terrific
It is so kid friendly that twice a month they have an hour or so of activities for kids.,so kid friendly
"These include a scavenger hunt or art contests, art projects, face painting, and more.",
The wow factor is that is is absolutely free.,absolutely free
"The staff are consistently friendly and engaging, they even bring your order to the table.",consistently friendly and engaging
"

I come her about twice a month with my girls, my 5 year old asks to go every day!",
