,0
"

Saturday mornings are always busy at diners and brunch places, but Perk-Cup felt empty of staff to clear tables and seat patrons.",busy at diners and brunch places
"This was an overall theme to the dining experience which was filled with long waits for food, and to pick up the check (i was given my check mid meal...and am still waiting currently to be cashed out...almost 7 minutes now).",
"The Garden Vegetable Baker was a good size portion of eggs, veggies, cheese, and hash brown with a side of toast.",brown with a side of toast
"

If you're work on your patience, please visit.",
"I certainly had plenty of time to practice my mindfulness of waiting, as well as check emails and social media.",
Speed up the service and this place will be great.,great
The best breakfast place in the area.,
"

We have been coming here since 2011, we bring friends and visitors.",
"First, it's a nice location with lots of parking, in a new plaza next to the train tracks.",
"The restaurant is large, very clean and includes a fireplace with chairs, as well as an outdoor patio.","large , very clean"
"

I recently stopped in to have a baker for breakfast.",
"It's a baked breakfast dish, straight out of the oven in a ceramic pot to your table.",
"Eggs, potatoes, and a variety of meats, vegetables and then topped with cheese.",
I had the VegetaBle baker and it was delicious.,delicious
"It came with rye toast, which was buttered.",
My wife had pancakes with blackberry brandy.,
She asked for the side order version as the normal portions are rather large.,rather large
The side portion included two large pancakes with a warm blackberry sauce that looked and tasted homemade.,
"

All costs are very reasonable, my dish was 6.99 my wife's was less than that.","very reasonable, less"
"As a final perk, when leaving they asked if we wanted another coffee to go.",
Who has ever done that before?,
Let me say that the food here is really good but the service is slow and at times chaotic.,"really good, slow"
Do not go if you are in a hurry.,
Servers run around like chickens with their heads cut off.,
They have no order or process for what they do which is a shame because the food is worth it.,worth
I like that you can create your own egg bake.,
I have gotten different combos and it's nice to be able to have it the way you want it.,able to have it the way you want it
 I'm not a coffee drinker,
but i am told tje coffee is really good.,really good
This is a great spot for meetings especially if you need to meet somewhere near the airport.,
I love the entire beverage menu worth chai tea lattes being my personal favorite.,entire beverage menu worth
I also really like he biscuits and gravy!,
I really want to like this place but every time I go there it gets worse and worse with every visit.,worse and worse
 ,
"Recently I went to get breakfast after church and after a 15 minute wait for a table which was expected I noticed other tables were crossed off their ""wait list"" that came in after us.",
 I get it that they would like to sit 4 people at a 4 person table,
but I really do not want to wait until one of their little 2 person tables opens up so we can be jammed into it.,
" Once again, I get it...",
I do not expect to be put at a 6 or 8 person table because that would be weird for 2 people.,weird for 2 people
"

After being seated we waited 5-10 minutes for a waitress to stop and take our drink order which she brought promptly back but would return to take our breakfast order.",
 Fast forward 25-30 minutes (I eventually put a timer on my phone as I was getting aggravated) another waitress stopped by and told us that there must have been a mix up.,Fast forward 25 - 30
" We ordered 4 over easy eggs, bacon, hashbrowns, and toast.",
" Fast forward a second time for another 30 minutes; we have not been checked on, I ran out of coffee, and the table seated at the same time we were had received their food, ate, and were signing their bill.",
" After the strenuous feat of flagging down the waitress that took our order but was not her table, we asked for a bill for the coffee and told her we were leaving because we had a prior obligation we needed to attend.",
" She seamed very put off that after spending over an hour to attempt to order 4 eggs (only half cooked so it should have been easier), a couple strips of bacon, hashbrowns, and toast; she told us ""its fine, don't worry about the coffee bill"".","easier, fine"
 And no apology offered.,
"

But seriously...  This is average breakfast food.",
" 4 eggs, a couple strips of bacon, hashbrowns, and toast???",
 Why didn't that just take it off of the buffet?,
 We could see giant piles of this in their roasters.,
But then again it would have been $15 per person if it came from the buffet.,
"

This is the first time we have ever walked out of a restaurant without eating.",
"We've eaten here several times, mostly because it's like five minutes away.",
" The food is pretty much average, though I do like the Farmer's Market English muffin sandwich.",pretty much
" After today, we will probably not be going back.",
" Though it really wasn't that busy, it took just over half an hour to get served.",that busy
" Dishes were coming out of the kitchen about eight minutes apart, and when ours was finally brought out, we asked the waitress if there was only one cook in the kitchen, and she said, no, there were two, but one of them was new.",new
 Poor planning on their part means we were sitting there hungry for way too long.,there hungry for way
" It is very clean and bright, but very wide open and not very cozy.","very clean and bright, very wide open, not very cozy"
" The food is passable, so if you don't mind mediocre food and slow service, this is the place for you.",passable
" Also, they only offer a limited menu on Sunday mornings, since they have the breakfast buffet then, so we haven't gone back there on a Sunday since we found that out........",
and now we won't be going back there at all.,
"This cafe is very spacious, with a nice cozy fire place and great decor.","very spacious, nice cozy"
Everything I have tried there has been delicious.,delicious
" I strongly recommend the Three Cheese Panini, and the Spicy Potato Soup (which I wish they would have regularly on the menu!).",
" You can't beat the prices, and I love that you can order breakfast all day every day.",
I like this place.,
"It has a nice atmosphere, good coffee and great breakfast I haven't been in for lunch yet, but plan on it soon.",
"

I have had breakfast there 3 time so far each time it was really good!",really good
Food was always hot and had good flavor.,hot
"The only bad thing I could say is that the service was a bite on the slow side, but they busy each time I was in there.",busy each time I was in there
"

It is nice to see a locally owned small business doing things the right way.",locally owned
I went here today to take a couple work clients out to lunch.,
I'm from Dublin Ohio but these clients are from the area and picked the location.,
The building itself looks brand new inside and out.,
The place is very clean and big.,very clean and big
I noticed that they have a party room also.,
"

They serve all day breakfast and have wonderful smelling coffee!",wonderful smelling
"

I had the short rib sandwich, the guys had a fish sandwich and quesadilla.",
Everything looked fresh.,fresh
My sandwich was outstanding!,outstanding
The meat was juicy and very tender.,"juicy, very tender"
The sauce was also very good.,very good
"

I would go back here in a heart beat.",
My Cleveland office is about a mile away from it and rest assure I'll be back!,
Nice place that has definitley improved over the years.,
French toast with bourbon peaches is SO good.,SO good
They now serve dinner.,
The food has always been priced reasonable and taste fantastic.,"reasonable, taste fantastic"
Dinner prices could be a little more expensive but the quality makes it worthwhile.,"a little more expensive, worthwhile"
"Stoped in on a Wednesday morning around 9:00, after a visit to my doctor's office.",
" Noticed all the cars in the parking lot and knew there wasn't an outbreak of malaria nearby, so I assumed they were here for some other reason.",
Glad I came in.,Glad
" The service was a bit slow getting seated and then getting my order placed, but to reiterate, just a BIT slow.","a bit slow, slow"
 The place was pretty crowded and the lag in service wasn't due to people not caring.,"pretty crowded, due to people not caring"
"

I wanted something light and simple, so I asked for 2 eggs over medium, ham steak, coffee and water.",light and simple
 The food came right out (brought by a different person than the one that took my order- good teamwork!) and was exactly what I expected.,order - good
"

There is also a nice 'lounge' area with a couple of leather chairs on either side of a fireplace.",
 Nice alternative to a Starbucks.,
Would not hesitate to come back again.,
"After I paid, waitress asked if I wanted a cup of coffee to go.",
4 stars just went to 5!,
"Average food, lousy service.",
The hostess was very monotone.,very monotone
She sat on her shift and stood up to greet me with no personality .,
"I requested a specific table by the front door but was told that was the ""owners"" table.",
"Odd they need their own specific table and would take away from paying customers, but hey it's not my establishment.",
Hostess sat me at the next table over.,
"The server was nice, but slow.","nice, slow"
I felt like I waited forever to get things.,
"Not bad, but not spectacular either.","bad, not spectacular"
"

When it came time to pay my server disappeared completely.",
I couldn't find her and needed to get back to work.,
After 10 minutes went by with my credit card just sitting on the table I flagged down another server.,
Asked her if she could cash me out.,
"Of course she couldn't, but would find my server.",
Waited another 2 minutes are so to be cashed out.,
"A bit of a ""hidden gem"" in a nondescript strip mall in Berea, just on the other side of the viaduct.",
 This place has a nice assortment of both breakfast and lunch dishes...,
I have had both and can attest to the quality and freshness of the food served.,
"My favorite menu item there is there club sandwich with fresh turkey, bacon and all the fixings.",
" Also, don't forget to try their ""loaded"" potato salad...",
a unique take on a traditional side dish.,
"

Have also been there late-night for coffee and dessert.",
" They have a nice double-sided fireplace with comfy lounge chairs to hang out, etc.",double - sided
"

Will definitely return once I move my office back to Olmsted Falls.",
The food was OK.,OK
"Definitely reasonable, cheap prices and large portions.",reasonable
I ordered an omelette and a pancake which were both decent.,decent
"Unfortunately, the service was not so good.",so good
I was greeted by someone who was hesitant to seat me.,hesitant to seat
She informed me that their credit card machine was broken so I had to pay in cash..,
No big deal.,
My server Jen was terrible though.,terrible
She looked miserable and was sitting down at a table most of the time.,miserable
She dropped my water off and didn't come back to take my food order.,
I waited for almost 10 minutes before waving down another server to take my order.,
"Instead of that server coming over, she yelled to someone else ""isn't that Jen's table?""",
And I had to wait until they could get Jen to come back to my table.,
"After I completed my meal, I asked Jen for my check to which she replied ""I don't know what I can do about that, our computers are down so I don't know how to get you your check.",
""" I waited for over 30 minutes and still had yet to receive my check.",
Jen hadn't come back to my table since to keep my updated.,
"She has horrible service, horrible personality and a terrible attitude.",
"

Don't waste your time here.",
You can get a better breakfast experience at almost any other breakfast spot.,
Perk-Cup is definitely a convenient spot to drop by if you want something different or healthy without getting out of your car.,different or healthy
"However, I didn't have the best experience.",
I ordered my food in advance and arrived when they told me my food would be ready.,ready
"When I first arrived at the drive up, I was food was still being prepared-",prepared
that's fine; I didn't mind waiting a few minutes.,fine
I ended up waiting 10+ minutes at the window.,
"Because or the issue, I was given a free cookie.",
"

All of this to say, the food isn't bad but I wouldn't bet on your food being ready when you get there!","bad, ready"
I love this restaurant.,
"
I'm a breakfast person",
and I find that they have a good breakfast menu and many coffee and tea choices.,
"
It is a lot like Fresh Start it that it is Very clean, and spacious, and the food is better than 90% of restaurants.","Very clean, spacious"
"You also can't beat the cozy fireplace, free WiFi and friendly staff.",
The sisters are wonderful and the staff is very kind and accomodating.,"wonderful, very kind and accomodating"
As a new business they have the started out well.,
I would recommend this restaurant to anyone.,
"Meals are good, affordable and portions are more than adequate.","good , affordable, more than adequate"
I rate it an A.,
"I've never ate the food here but, I've gotten coffee here a few times.",
"Although, they have some good mochas...",
I don't think it's worth the price at all.,worth
"For two mochas, it'll cost you $10 & some change.",
I believe the prices have gone up on the drinks because a few months ago I swear it was less than $10.,
The iced drinks only come in one size which is a downfall because sometimes I want a small iced drink.,
"Really overpriced for a place like this so, I'm just going to be getting my coffee fix elsewhere.",Really overpriced for a place like this
Stopped in for a quick soy latte and a caramel brownie w graham cracker crust.,
Place was packed (Saturday around 11:20am).,
"Soy latte was solid and the brownie was delicious (which it shoulda been for $6)
Will be back when we visit again","solid, delicious"
Two coworkers and I met for brunch here as a last minute decision.,
One of the girls (who was coming with her baby) literally lived right around the corner and our plan was to head to Great Northern after so we decided to check this place out and boy were we glad we did!,glad we did
"

Doesn't look like much on the outside, but he place is adorable.","much, adorable"
It has a bunch of tables with waiter service and then has some couches with a double fireplace where you can catch up with friends and just have coffee if you're not looking for anything sit-down.,sit - down
"The decor is super cute, too.",super cute
Very coffee-shop-esque.,Very coffee - shop-esque
"

For being a Wednesday morning, there were definitely a lot of tables full of people.",
"We started off with some coffee, which was good.",good
The breakfast menu is pretty big!!,pretty big
"It was so hard to decide what to get, but I settled on a breakfast bake that had artichokes, tomatoes, spinach, hash browns, scrambled eggs, and cheese.",so hard to decide what to get
It was delicious!,delicious
It was baked in a ramekin so it stayed steaming hot during my entire meal which was nice.,"baked in a ramekin, nice"
I got a biscuit instead of the toast.,
"The biscuit was ok, a bit dry and could have used some more salt.","ok, a bit dry"
"My friends enjoyed their meals, as well.",
The waitress was super friendly and came by often to refill coffee or make sure we didn't need anything else.,"super friendly, sure we did n't need anything else"
"Another employee (manager?) kept coming by as well, which was nice in the beginning but began to get pretty annoying.","nice in the beginning, pretty annoying"
She kept interrupting conversation to talk to us about the baby or her childbirth experience....,
we do NOT want to hear that during our meal.,
"And like I said, while it was fine the first few times, the number of times she came over was just a bit much.","fine, a bit much"
"Overall, the food was great, the prices were very reasonable (9 dollars for my meal?","great, very reasonable"
I can def do that...,
"she didn't charge us for any of our coffee which was nice), and the service was good.","nice, good"
I will def come back here.,
"

PS for those who live nearby, they have a drive thru if you prefer to grab your coffee and go!",
The Brunch on Sunday is excellent!,excellent
The staff is very friendly and helpful.,very friendly and helpful
I especially enjoyed the thick bacon!!,
It was real bacon.,
The omelette station had a good variety of toppings too.,
I would definitely come back.,
A really nice breakfast place that's out of the way.,"really nice, out"
It's perfect for a breakfast date with your significant other.,perfect for a breakfast date with your significant other
The service was fast.,
"Definitely get there by 9am on Sunday, because it gets pretty busy.",pretty busy
"I definitely recommend going there whether it's for brunch with your girlfriends, your family or with your significant other.",
"We have been going to the cafe since it opened,  The food is great, the waitresses are very and know the menu.","great, very"
 I love the homemade soups !!,
Giving them 5 stars - Food is fine..,fine
no complaints.,
I have found service at Perk Cup is best when served by Kim M. or Stacey.,
These two will make your dining experience very enjoyable.,very enjoyable
Good food but took an hour and half just to get seated and eat breakfast.,
Service was slow and they were understaffed.,"slow, understaffed"
Tried this place out on a Sunday for their brunch.,
" I loved the variety of food offered, and the quality exceeded my expectations.",
" The staff was very accommodating (I had a baby in tow), offering to carry my diaper bag to table and holding the doors for me as I left.",very accommodating
" The only thing keeping this from a 5, is the wait was longer than I would tolerate which is a result from a high demand for tables that they just don't have.",longer
"Hopefully, this is just a growing pain.",
"Nonetheless, I will be back and recommend this to anyone entertaining the idea of trying out.",
Their drink menu is great.,great
It's clean and well decorated.,"clean, well decorated"
Their buffet on the weekend is very good.,very good
The service is generally very slow for the number of tables they have at a time.,very slow for the number of tables
Overall a very average dining establishment.,very average
I wish they had more vegan options.,more vegan
I've been here many times for breakfast.,
I will not go back.,
They don't sell newspapers.,
I ask for one every time I go there....,
they don't get the hint.,
"Also, I want real butter with my toast and they don't have it.",
And they act 'put out' when I ask for it.,
Tired of being treated like a villain when show I in interest in ingredients.,Tired of being treated like a villain when show I
Also servers have to many nose rings and tatoos to stimulate my appetite.,
Sorry,
but I'll go to a chain restaurant next time.,
"At least I can expect bad, unhealthy food there.",
"On July 10, 2015, my family and I were looking for a new place to eat breakfast.",
I found the perk-cup cafe online and thought it would be great to try a new place for breakfast.,great to try a new place for breakfast
The place was pretty empty and we still waited for a seat...,pretty empty
it took a long time for our waitress to even make an initial visit.,
We have two daughters and the one is two years old so things can get hectic at times.,"two years old, hectic at times"
Our two year old daughter had peed herself in her pull-up diaper.,
The seat got wet so I quickly rushed to the bathroom and retrieved paper towels.,wet so I quickly rushed to the bathroom and retrieved paper towels
While I cleaned the seat and placed our daughter on paper towels the waitress finally showed up and asked what we needed for drink.,
Meanwhile my wife said to save from any further embarrassment we should wait after we place the order to take her to the car to change her.,
Thinking it should be quick for the waitress to return with our drinks and to take our order we started to get uncomfortable when she took a while.,"quick for the waitress, uncomfortable"
Our thought was that she noticed the accident and was talking about it to the other staff.,
"When she returned to our table it was very awkward when she rudely asked about the accident and said ""I wouldn't want to sit in that seat after that.""",very awkward
"Instead of asking if we needed help or even being understanding that two year olds can have accidents, she decided to make us feel terrible about the entire incident.",terrible about the entire incident
She was more consigned about the chair than offering to assist with this embarrassing moment.,more consigned about the chair
The mess was cleaned off of the vinyl chair and I had placed paper towels until my wife went to the car for another pull-up diaper.,pull - up
"I then asked for the manager and she was also the owner, at first she sided with the waitress.",
After hearing my side she said that she will talk to the waitress about the incident.,
My wife and I took vacation to relax and not experience any stressful or unnecessary drama.,stressful or unnecessary
"We are both educated professionals and also manage people for a living, after seeing so many infractions on this visit, it was determined that we will not be visiting this establishment ever again.",so many
"After reading other negative  postings and one about their two year old child that had to sit on his father's lap for breakfast due to lack of service, obviously this place is not a family friendly restaurant.","two year old, family friendly"
What a let down.,
"We did however went to another restaurant in downtown Olmsted falls, the waitress was delighted to assist our family!",delighted to assist our family
She was very polite and gave attention to our kids!,very polite
What a difference it was and we were generous with the a 40% gratuity tip.,generous with the a 40 % gratuity tip
We are people that usually give compliments to assure good service and it takes a lot for us to give negative feedback.,
Please reconsider this place if you are looking for breakfast as a family with kids.,
Business need to realize that all the customer wants is good service and to be understood when needing assistance.,
I really hope the staff and owner gets training in customer service.,
Just stumbled upon this place by chance.,
Wow!,
What a gem.,
very nice feel to the place.,very nice
Very open and clean.,Very open and clean
Good quality food.,
I had a piece of home made pecan pie and it was excellent along with good coffee.,"made pecan, excellent along with good coffee"
Menu looked really good but didn't stay to eat more.,really good
"Nice lunch spot, clean and spacious, and I always like a place with a cozy fireplace.",clean and spacious
" Had a decent but not huge selection on their lunch menu, including sandwiches, wraps, salads, as well as the daily lunch specials, which included a soup of the day, quesadilla of the day, and two quiches.",decent but not huge
 Also a number of specialty coffees.,
" You place your order at the counter, and the meal is brought out to your table.",
"
Overall, a very satisfactory place for a workday lunch.",very satisfactory
" I wasn't there for breakfast, but the breakfast menu looked good, with choices listed including waffles, omelets, hot oatmeal, and eggs Benedict.",good
Still haven't eaten the food here,
but I wanted to give their mocha another try since I didn't want Starbucks or Dunkin.,
"

I got a iced caffe mocha & it was really good this time!",really good
It was also even cheaper than the last time.,even cheaper
I guess the prices depends on who's doing the coffee.,
"

This place has been redeemed, totally coming back here again to get my coffee fix.",
"This place is overpriced, management is super unfriendly, not happy about the food either.","overpriced, super unfriendly, not happy about the food"
If you are in Berea you're better off going literally anywhere else.,better off going literally anywhere else
"Takes forever to get recognized when you walk in and when you sit down you're not even greeted for another 15 minutes, and as a waitress myself, that makes me cringe.",
Would not send friends this way.,
Only to maybe grab a cup of coffee through the drive through so you don't have to go inside and actually receive the bad service.,
Stopped in on a Monday morning w my parents.,
"The place is nice inside, pretty typical for a modern coffee shop - comfy seats made for chillin, local art on the walls, double fireplace.","nice, pretty typical, modern coffee shop - comfy"
Good for the college kids.,
"We had breakfast, starting with a ghiradelli hot chocolate w whipped cream",
and I asked for mint.,
"It came out fairly quickly, wasn't too hot, ready to drink right away, and was okay - coulda been richer.","too hot, ready to drink right away, richer"
My parents got the French toast w bourbon peaches,
and I got the sweet and savory w chocolate chip pancakes.,sweet and savory
"The food took a pretty long time to make considering it was empty and breakfast food, but it was solid.","pretty long, empty, solid"
"Nothing special, but well made.","special, well made"
"Prices were pretty low, so I'm going for a 4, though it's more of a 3.5","pretty low , so I 'm going for a 4 , though it 's more of a 3.5"
Solid coffee shop.,
 Reasonable prices.,
 Friendly staff.,
 Daily specials.,
 Plenty of seating and free wi-fi.,
" I actually think this place would be more popular if it were smaller (it sounds strange to say that), because it feels a little bit too open to me.","more popular, smaller, strange to say that, too open"
 Kind of a mix between a Panera and a Starbucks.,
 Absolutely worth a visit.,
