,0
"And yes, as far as fast food goes, they can't do any better.","as fast, any better"
"Ok,this place is amazing!If you had a stomach ache before,(which I did),I never got one for 2 WHOLE YEARS!!!!And don't get me started on the chicken deluxe...",
"

They have everything from Soup to chicken to sandwiches to salads to you get the point...",
"And they have also a lot of dressing choices,hot sauce,ketchup,ranch,etc.",
I also want to tell you about their Chick-Fil-A sauce..,
"If you like eccentric/Unusual sauces,it's good.","eccentric / Unusual, good"
"I think many
Would like it either way..",many
"

Overall I rate 5 stars.",
"Now,this is ""Overated Review"" but Food is good,not to greasy,AMAZINGLY customer support,and CLEAN restrooms.","good, greasy, AMAZINGLY customer support"
"They also clean every table when the person leaves,and another clean every 5 minutes,so there's that.","clean every table when the person leaves , and another clean every 5 minutes , so there 's that"
"And the Play Area,(not
5),but I can tell it's amazing,EVERY kid wants to go there,and from the looks of it,it's clean!The drive thru also serves the Best Drive Thru food,and it's exactly if you were to go inside!Also,The cashiers say words like ""Your Welcome"" and have a positive smile that you can't resist!","amazing, clean!The drive thru also serves the Best Drive Thru food"
"I didn't know they charged extra for lemonades, which was a down side.",
" But other than that, all food are still great, service still excellent.","still great, still excellent"
 Great jobs everyone!,
I went 3 days ago and got a meal of Chick-fil-A Nuggets with waffle potato fries and a lemonade drink.,
"The nuggets are ok, I think the fries were better.","ok, better"
And the lemonade was too sweet too much sugar...,"too sweet, too much"
diabetes?,
"As for the sauces, the only one I liked was the bbq",
but they stingy with them.,
This location is always clean and the staff is friendly.,"clean, friendly"
I visit here when the truck is being serviced next door.,
The same team always seem to be working the front as well.,
Pristine both for food and experience!,
"Love the food here, it's so fresh and made to order.",so fresh
 They don't leave any food on the hot plate or under the lights.,
 Love the waffle fries and their milkshakes.,
 All the employees that works there are very polite.,very polite
 Just love it.,
One of my favorite chicken places to eat.,
"
Always fresh and delicious 
Staff is alway helpful.","fresh and delicious, helpful"
My drive through orders are always complete.,complete
No worries,
I'm never coming to this location again.,
The lady literally burped the second she opened the window to give me the food.,
She also gave me the wrong order and I didn't get a chance to look at it until I got home.,
"I called to let them know they gave me the wrong order and the manager offered to fix the order if I drove back to the location,  ",
but it wasn't worth my gas money to drive back.,worth my gas money to drive back
Chick-Fil-A is a great grab and go or sit and dine fast food.,
It is my favorite in town.,
The people are all so friendly.,so friendly
They have options from Soups and Salads to Chicken Nuggets and Mac-n-cheese.,
I highly recommend the Cobb salad with grilled chicken.,
The diet lemonade is enjoyable also.,enjoyable
The only complaint I have is that the kids play section is usually really germy.,really germy
Enjoy!,
"I love the spicy chicken sandwich, also the iced tea/lemonade mixture I usually get instead of soda.",
The waffle fries are usually awesome when they are fresh out of the fryer... unfortunately the batch I got yesterday were cold and tasted like an ashtray.,"fresh out of the fryer, cold"
"The dog enjoyed them, though.",
So good.,So good .
"the sandwiches, the salads, the ice cream.",
"and of course, the fries.",
sooo good.,sooo good .
and chik fil a sause is the best.,
and it is all pretty healthy for you too!,all pretty healthy for you
"Ok, yes I am writing a review for a fast food restaurant.",
I realize that seems a bit strange and quite possibly extremely unnecessary.,"a bit strange, possibly extremely unnecessary"
"I mean, fast food is fast food right?",
"Everyone knows what their getting into and what kind of food to expect, right?",
While this is true I felt it was worth writing a little snippet for the always refreshing Chick-Fil-A.,"true, always refreshing"
It's nice to have a fast food experience where the food tastes fresh and actually like real chicken.,fresh
"The nuggets are yummy, flavorful but not overbreaded.",
My parents enjoyed their chicken sandwiches and agreed that the food is fresh tasting and not too heavy.,not too heavy
We also enjoyed the sweet tea which is a classic Chick-fil-A staple.,
"

One important thing to note was that this location was super busy when we walked in right at noon but soon after we ordered our food was ready in a flash.","super busy, right at noon, ready in a flash"
And for those of you who have never been to CFA before?,
The icing on the cake is the wonderful assortment of dipping sauces to suit whatever flavor mood you are in at the moment.,
Or you can do what I do and open one of each and dip to your hearts desire.,
Who doesn't love variety?!,
The classic chicken sandwich with cheese is fantastic for a quick lunch.,fantastic for a quick lunch
But I have stopped going altogether because the woman who works the dining room during lunch insists on having 3 different interactions while I am trying to chew my food.,
"

First time she asks if everything's ok.  ",ok
Next time she asks if she can refill my untouched soda.,untouched
 And the third time she asks if she can take my tray.,
I recognize that probably follows her training guidelines.,
But it is not working for this guy.,
All I want is 20 minutes of peace while I eat.,
 I am more than capable of expressing any unmet needs.,more than capable of expressing any unmet needs
The one on Camelback is so much better.,so much better
"The grilled nuggets taste better, the service is better, they actually give me the sauce I ask for...","better, better"
it's honestly gotten worse over the past few months.,worse
They almost always give me the wrong sauce but the last time I went I didn't get ONE of the correct sauces I asked for.,
I feel like they are just lazy teenagers who don't give a crap.,
I didn't realize the difference in the food until I recently went to the one on Camelback and the grilled nuggets tasted fresher.,fresher
Take some notes from that location!,
I am so impressed with the patience and kindness of the workers at Chick-fil-A.,so impressed with the patience and kindness of the workers at Chick - fil - A.
They are always so nice and proactive with getting you what you need.,so nice and proactive with getting you
It is a parent's dream - the play place is awesome and I can get a Diet Lemonade and sit in the booth and watch my 3 year old play.,awesome
The salads are fresh and delicious.,fresh and delicious
The kids meals are great and I really appreciate the toy which is always educational and interactive.,"great, educational and interactive"
It's very nice and clean.,very nice and clean
Mad house during lunch time so plan ahead.,
The frozen lemonade it delicious,delicious
"Eh it was ok, not as amazing as everyone tells me it is.","ok , not as amazing"
When I lived in Vegas everyone would say if Chick-Fil-A was here Raisin Cane's would be put to shame...,
HAHAHA,
yeah right!,
I am glad I tried this now because nothing here stacks up to it.,glad I tried this now because nothing here stacks up to it
The Chicken was really solid could tell it was fresh cut before fried.,really solid could tell it was fresh cut before fried
But it just was lacking in flavor.,
The sauce was not inspiring but OK.,inspiring
( I did take 8 packs home to Seattle with me),
But it was nothing like the Canes sauce.,
The Sweet Tea was even disappointing vs Raising Canes.,
Overall compared to other fast foods it is better than most.,better
"But, I only eat fast food if it is outstanding and this was not it.",outstanding
Chick-fil-a is comfort fast food for me.,
I love the original chicken sandwich; I add 1 pack of honey mustard.,
"I grab a second honey mustard packet for dipping my delicious waffle fries - which, unfortunately, they sometimes skimp on, in my opinion.",
"

I have to tell you, though, I witnessed the talent of the best balloon artist I've ever seen at this location!",
"(He's not there every week, but you'll find him there on some Wednesday afternoons for the whole ""kids eat free"" thing.)",
"I was so mesmerized, as I waited in line to order and then for my food,  that I hardly noticed the wait and the fact that the place was overrun with little ones didn't detract from my experience!",so mesmerized
Chick-fil-a actually caters to the whole family thing really well.,
"(And, their kids' meals have educational toys, often promoting literacy).",
There are a lot of food choices in the Valley.,
"Moreover, there are quite a few Chick-fil-A's to choose from.",
"That being said, I would highly recommend you NOT spend your money at this Chick-fil-A. I ran through the drive thru one day with my kids and ordered lunch (I hadn't been to this location in years).",
We asked for 3 ranch and 3 chick-fil-a sauces with our meal.,
When we got up to the pay window the girl informed me that we'd have to pay for the extra sauces (they only give you 2).,
"Ok, no problem.",
But then she rolls her eyes and gives me the snottiest attitude about it.,
"She says """,
"yeah, it's because, you know, people like this (me) who order to much sauce"".",
Ummmm....sayeth what?!,
Chick-fil-A is typically the Ruth's Chris of fast food but this location is more like a dirty Burger King.,
Take my advice and Spend your hard earned money at a different Chick-fil-A.,
"Over the years, I have taken a strong liking to Chick-fil-a.  The chicken is tasty and is not processed like the other fast food restaurants.",tasty
 The waffle fries are delicious.,delicious
The staff is extremely friendly and at times will come to the table and offer free soda refills.,extremely friendly
Each Wednesday they have a Kids Night from 5:00 p.m. to 7:00 p.m.  Last week there was a balloon artist.,
 It is a fun time had by,
Marco was the most polite and great guy ever he even had a lil fun sliding our cards:),most polite and great
Typically on every visit to this fine establishment the service and food and has been spectacular.,spectacular
However this time I suffered from a subpar experience.,
The meal was less than adequate and was quite underwhelming.,"less than adequate, quite underwhelming"
Great staff.,
Very friendly and attentive.,Very friendly and attentive
Tables that turn quick get cleaned just as quick.,quick
Nice!,
Their new salads are fresh and crisp.,fresh and crisp
"Stopped by for lunch today,  very fast responsive service and the food was hot and fresh.","very fast responsive, hot and fresh"
 Couldn't have asked for better.,
 Good job guys.,
First time at a Chik FilA  ever.,
In a pinch for food while running around town.,
"
Ordered a cool wrap.",
"
Paid six dollars.",
"This ""wrap"" tasted worse than what I imagine the sandwiches in gas station coolers taste like.",worse
"Salty, non food bright orange cheese shreds with cold grilled chicken by-product pieces and lettuce all wrapped in a dry tortilla.",bright orange
"

Truly disgusting.",Truly disgusting .
I thought about returning it for my money back.,
"
Threw it away instead.",
"Teen girls goofing around in the window, not doing their job.",
"Messed up about 50% of the order: gave us the wrong drink, then gave us the wrong thing again after ""fixing"" it.",
"We were also charged for extra items that weren't asked for; however, we expected more from Chick-fil-A and trusted them enough to drive away without checking.",
Hire more mature workers who don't stick their nose into other people's business that are outside of the window.,more mature
I don't think it's necessary to have 5+ teen girls in the window.,necessary to have 5 + teen girls in the window
"Great customer service and high quality, delicious food every time.",
There was a line wrapped around the building and I waited no more than 3 minutes after ordering to get my food.,
They had a young man outside taking orders which made the ordering process smooth and very efficient.,"smooth, very efficient"
Good job Chik Fil A!,
"I don't do fast food very much anymore, but I stopped here over the weekend to show Chick-Fil-A some love for standing by their morals.",
" I was in the area to visit another store, and made sure to stop here for lunch!",sure to stop here for lunch
"The employees here are very friendly and helpful, as they are at every CFA I've been to.",very friendly and helpful
"If you're unfamiliar with their menu, they have breakfast from open to 10:30 - the awesome CFA biscuit, and bacon-egg-cheese, and others.","unfamiliar with their menu, open to 10:30"
My favorite items on the rest of their menu is the regular CFA sandwich and the spicy chicken wrap...,
"I get them with fruit cups instead of fries, and their great sweet tea.",
Yum!,
"This is a treat, not a regular thing for me, but I'm glad to support them.",glad to support them
"This location is at the corner of Tatum and Cactus, on the SEC, in the same area as the Wal-Mart and Michael's.",
So did a mobile order for the first time.,
It was super easy!,super easy
Also ordered breakfast for the first time at Chick-fil-A.,
I got the chicken biscuit & 4 count minis & hash browns.,
It was delicious.,delicious
"The chicken biscuit was super good, you can taste the honey in the biscuit.",super good
"It's good with any sausage for example mayo, ranch or polynesian.","good with any sausage for example mayo , ranch or polynesian"
Polynesian sauce is my favorite for the chicken biscuit & minis.,
They do have a couple of outdoor seating.,
There's a play place inside.,
"

Download the Chick-fil-A app to earn points to earn free food.",
Compared to the one in Deer Valley where I work.....this one needs some serious improvements.,
I know Chick-Fil-A takes it's customer service....,
food....,
and store cleanliness very serious.,very serious
This one however is the exception especially when it comes to cleanliness and organization.,
This locale is always messy....,messy
the condiments are always disorganized....and the lemonade on my last 3 occasions has not been good..... for lack of a better word.,"disorganized, good"
I am shocked and appalled really because I have been to several of these establishments and if the managers there could see this store they would be shocked as well.,shocked and appalled
"Eat, Drink, and be Merry my Friends.....just not at this Chick-Fil-A.",
If you are going to eat fast food them this is the place to go...,
"good chicken sandwiches, yummy shakes and great kids meals.",
"I love Chick-fil-A, especially their fries.",
But one thing I don't understand is why they don't post their closing hours anywhere.,
 I literally searched it doesn't sites and none of them had a time for that location.,
Always busy but fast and efficient nevertheless!,"busy, fast and efficient"
"The chicken is nicely breaded, flavorful and juicy!",flavorful and juicy
You can get it grilled too.,
"The chicken can be a sandwich, nuggets or on a salad- all good choices!",
Love their chicken but not for corporations who speak out on political or religious views.,political or religious
You're a fortune 500 company.,
You make chicken sandwiches.,
Just make chicken sandwiches and keep your mouths closed and I'll keep coming for your chicken.,
God knows if I was blessed with a fortune 500 food chain I would be on my own island speaking my beliefs to myself.,
Y'all already know.,
"It's a Southern thing, brought out here to provide delicious fried chicken with a smile and a very subtle Southern Baptist sense of humility and service.","delicious, very subtle"
You'll NEVER have inconsistent quality.,
Your kids will love it.,
It's impossible to get sick of it.,impossible to get sick of it
"I grew up near the original, I will never live more than a mile from a branch of this staple.",
Went here for 2018 cow appreciation day.,
I had never been to this CFA and it was ABSOLUTELY PACKED FULL!,
It had a line out the door and the parking lot was crazy full.,crazy full
Even the drive through was full of cars.,full of cars
"Despite this location being the busiest CFA I have ever visited, our food came out the fastest of all six CFAs I visited that day.",
So I order a chicken sandwich with no Pickles.,
At the drive thru I check and it has pickles.,
I point this out and ask for a new sandwich.,
Was a quick turn around,
and I though nothing of it.,
"I get home, take the top bun off and its covered in Pickle seeds.",
"They didn't make me a new one, just took the pickles off.",
Now how a restaurant should handle an issue like this imho.,
The last time I went to a Chick-Fil-A was about 15 years ago in the mall and was unimpressed and it would have been a 2.,unimpressed
 They have gotten better.,better
 I chose the grilled chicken breast combo and it was ok.,ok
The fries were not very crispy.,very crispy
Afterward I was told by friends I should have gotten the original delux,
and I would have preferred the taste,
"but I assumed there were fewer calories, salt and fat in the grilled",
and I was correct when I checked.,correct
 The restaurant was clean and everybody was pleasant.,"clean, pleasant"
So they have moved up from avoiding them to acceptable but not going out of my way.,acceptable
They need to just stick with their chicken sandwiches and waffle fries.,
 Their coffee tasted horrible as there's no coffee taste at all.,horrible
Clutch chicken sandwich as always.,
No errors with my order.,
Line was long but worth the wait.,long but worth
"I'm not from the area but where I'm from our chick fil a has good customer service, and isn't stingy on their sauce.",
They give our handful.,
"But I came here twice, employees looks to be in their teen years or early twenties.",
They have some attitude.,
Seem to not care.,
Second time coming here I wanted to make sure everything was in the bag and they replied so rude as if they wanted us out of there.,so rude
They weren't packed like the first time we came here.,
"The first time a young man was handling our drinks, thank god we caught how many he gave us because he forgot one, his fault because we witness him conversating with other employees.",how many
Asking for sauce and not give us a lot.,
Overall the food is good.,good
Just they need to work one better service and positive attitude!,
Made a bad night really special.,really special
"


",
"On Nov 8th around 8:30pm, me and my boyfriend went to pick up some dinner after a crappy day, and an even crappier week.",even crappier
"All I wanted to sooth my sorry soul, was a spicy chicken sandwich from Chick-fil-A.",sorry
"We placed our order, and pulled through to pay for our food.",
I had knowingly left my wallet at home.,
so my boyfriend reached into his pocket to get his.,
"He sighed deeply, and turned to me and said, ""I left my wallet in my backpack at home.",
""" My stomach dropped, and I was pretty crushed, because seriously....",
all I wanted was a stupid chicken sandwich...,
"So we pull through, and I let a young blonde woman know that we forgot our wallets at home and couldn't pay for the food.",
"She smiled and without missing a beat said, ""Don't worry this one is on us.""",
"No guilt, no second guessing, just no problem and a smile.",
"

Touched, we thanked her and pulled up to get our order.",
"Not only did we get our (delicious) food, we also got a few extra of our favorite sauces as a little icing on the cake.",-LRB- delicious -RRB-
You didn't know how stressful our week had been.,
You didn't know that all I wanted was that chicken sandwich....,
you were just being kind to a stranger in your drive thru.,
"I want you to know that this stranger really needed, and appreciated it.",
"Young-blonde-woman-who's-name-I-don't-know, thank you for your kindness.",
And thanks Chick-Fil-A for empowering your employees to show that kind of compassion to your customers.,
"

It was the most delicious sandwich I ever ate :)",most delicious
There was a male manager who was especially extremely rude.,extremely rude
If something goes wrong they don't have to take it out on the customers.,wrong
They could say it nicely even if something went wrong.,wrong
They could also use trash cans at there drive thru just like all the others.,
Love to come here for the fries and shakes!,
"Delicious and quick, friendly service.",
Usually good service but not today!,
I forgot to exchange out my daughters fries for fruit and when I went to ask they said no.,
I've never had issues with the customer service until today!,
Pretty disappointed by them.,Pretty disappointed
Maybe the person who took my order should have asked fruit or fries but his service was lacking as well.,
Yummy eat em ups thanks hot food great people who very assertive and showed much more care than most places.,"very assertive, much more"
Highly recommended,Highly recommended
"So I was doing the no carb thing for awhile and my very first carb loaded meal was at Chik-Fil-A.  One would think that after not eating carbs for a couple months, anything would taste divine---- WRONG.",very first
Chi-Fil-A used to be in malls when I was younger,younger
and they would hand out free samples of the yummy fried deliciousness on little toothpicks when you walked by.,
"This then would make me turn to my mother and beg, plead, cry to eat at Chik-Fil-A.  It was really good then.",really good
 This was my memory when I went to the Tatum location.,
 What I got was a super fried chicken fillet that needed salt-- gasp!,
 Who actually adds salt to fried chicken?,
"Well, this one tasted bland.",bland
", so I HAD to.",
 My bun was soggy and my fries were cold.,"soggy, cold"
 Is this really the carbs I was craving all this time?,
No.  I should have gone to have sushi.,
"

the 2 stars are because I WANT it to be more that 1 star.",
"

I give it another go ahead, a few weeks later-- at this point I have eaten so many carbs my pant buttons are popping off and AGAIN!",so many
 cold fries and soggy bun.,
 WTF??!!,
" I haven't been back since and since I am on a NEW diet, I won't be heading there anytime soon.",
 Boooooooo.,
Love their chicken sandwiches and biscuits!,
"Their lemonade is awesome, as well.",awesome
The service at this location is always fast and friendly.,fast and friendly
The food is hot and fresh.,hot and fresh
I stop here pretty often for breakfast on my way to work.,
"You can order a sandwich instead of a biscuit for breakfast, if you prefer! :)",
Why is it that Chick-fil-A seems to have great customer service at almost every location?,
Why can't the other fast food chains get it right like these guys?,right like these guys
"Friendly employees (none of which I saw using a cell phone on-duty), fast service and my order is always right.",right
"Keep it up Chick-fil-A, whatever you're doing is working! :O)",
You know the rep chik fil a has?,
They have outstanding customer service right?,
Nope!,
Not this location!,
Each and every time I go here because it's closest to work they have a snotty ghetto attitude.,"closest, snotty"
And they love to argue with you about how many sauces they can give you!!,how many
I order TWO separate meals and ask for only 3 sauces each.,
They try to shag me by giving me 2 total!,
Then they argue because they try to charge you extra for sauce!,
" 

Definitely need a make over at this location.",
It's a good Chick-fil-A.  Prompt drive-thru service.,
 Nice touch with the shade along the wait.,
 It gets pretty packed and the cars go out of the parking lot.,pretty packed
 Food was fine.,fine
 It was good for a quick dinner with my parents.,good for a quick dinner with my parents
